{
  "schema_version": "ats.rule_capability.v1",
  "implementation_name": "ats",
  "implementation_version": "0.5.1",
  "ats_version": "1.0.0-draft.3",
  "rules": [
    {
      "authority": "proposal_only",
      "available_inputs": [
        "ir_document",
        "basis_policy",
        "profile"
      ],
      "blocking_inputs": [],
      "decision_power": "detects_violations",
      "detector_class": "D3",
      "detector_name": "ats-ir-ats-basis-001",
      "implemented": true,
      "known_limits": [
        "The basis enum (EXPLICIT, DERIVED, INFERRED, UNAVAILABLE, AUTHOR_JUDGMENT) is enforced by schema; this detector checks presence only. Whether an omitted basis is genuinely nonessential is the author's judgement, and the rule's review_required class defers that to review."
      ],
      "missing_inputs": [],
      "produces_conformance_evidence": false,
      "required_inputs": [
        "ir_document",
        "basis_policy",
        "profile"
      ],
      "rule_id": "ATS-BASIS-001",
      "subchecks": [
        {
          "subcheck_id": "material-claim-without-basis",
          "decides": false,
          "spec_ref": "ATS-1 4.25, 7.19",
          "vocabulary_source": "the semantic_basis definition at ats_common_v1.schema.json#/$defs/semantic_basis",
          "description": "A material claim or requirement slot declares no semantic_basis, so the source of its semantic values is undeclared."
        }
      ],
      "surfaces": [
        "ir"
      ],
      "unavailable_conditions": [
        "A document with no material claim or requirement declares no material semantic value whose basis could be checked."
      ]
    },
    {
      "authority": "conformance_evidence",
      "authority_basis_ref": "docs/AUTHORITY_MODEL.md#ats-ir-rule",
      "available_inputs": [
        "source_ir",
        "output_ir",
        "profile"
      ],
      "blocking_inputs": [],
      "decision_power": "decides",
      "detector_class": "D1",
      "detector_name": "ats-ir-ats-basis-002",
      "implemented": true,
      "known_limits": [
        "The comparison is mechanical: a claim declaring basis EXPLICIT while the source basis recorded for the same value is INFERRED or UNAVAILABLE is a silent promotion. Whether the source truly established the value is a semantic judgement; when the comparison cannot be made the detector flags a violation for review rather than passing."
      ],
      "missing_inputs": [],
      "produces_conformance_evidence": true,
      "required_inputs": [
        "source_ir",
        "output_ir",
        "profile"
      ],
      "rule_id": "ATS-BASIS-002",
      "subchecks": [
        {
          "subcheck_id": "inferred-source-promoted-to-explicit",
          "decides": true,
          "spec_ref": "ATS-1 4.25, 7.19",
          "vocabulary_source": "the semantic_basis values enumerated at ATS-1 4.25",
          "description": "An output claim declares basis EXPLICIT while the source basis recorded for the same value is INFERRED or UNAVAILABLE, silently converting source material into an explicit source-authoritative fact."
        }
      ],
      "surfaces": [
        "output"
      ],
      "unavailable_conditions": [
        "The output presents no claim whose declared basis can be compared against a recorded source basis, so no strengthening comparison is possible; the rule reports UNAVAILABLE rather than PASS by absence."
      ]
    },
    {
      "authority": "conformance_evidence",
      "authority_basis_ref": "docs/AUTHORITY_MODEL.md#ats-ir-rule",
      "available_inputs": [
        "ir_document",
        "profile",
        "requirement_ir"
      ],
      "blocking_inputs": [],
      "decision_power": "detects_violations",
      "detector_class": "D1",
      "detector_name": "ats-ir-ats-close-001",
      "implemented": true,
      "known_limits": [
        "Presence mechanics only: actor, deontic, action, and object presence plus acceptance-criterion and dependency reference resolution are decided mechanically. Whether the recovered meaning is genuinely sufficient for action is a semantic judgement, so a clean run is REVIEW_REQUIRED, not PASS."
      ],
      "missing_inputs": [],
      "produces_conformance_evidence": true,
      "required_inputs": [
        "ir_document",
        "profile",
        "requirement_ir"
      ],
      "rule_id": "ATS-CLOSE-001",
      "subchecks": [
        {
          "subcheck_id": "requirement-slot-missing-actor",
          "decides": true,
          "spec_ref": "ATS-1 4.24, 7.18",
          "vocabulary_source": "none",
          "description": "A requirement slot declares no actor and no inherited-scope marker, so the unit's operative meaning depends on undeclared document-wide inference."
        },
        {
          "subcheck_id": "requirement-slot-missing-deontic",
          "decides": true,
          "spec_ref": "ATS-1 4.24, 7.18",
          "vocabulary_source": "none",
          "description": "A requirement slot declares no deontic modality."
        },
        {
          "subcheck_id": "requirement-slot-missing-action",
          "decides": true,
          "spec_ref": "ATS-1 4.24, 7.18",
          "vocabulary_source": "none",
          "description": "A requirement slot declares no action."
        },
        {
          "subcheck_id": "requirement-slot-missing-object",
          "decides": true,
          "spec_ref": "ATS-1 4.24, 7.18",
          "vocabulary_source": "none",
          "description": "A requirement slot declares no object."
        },
        {
          "subcheck_id": "acceptance-criterion-ref-unresolved",
          "decides": true,
          "spec_ref": "ATS-1 4.24, 7.18",
          "vocabulary_source": "none",
          "description": "A requirement's acceptance_criterion_id resolves to no declared acceptance criterion."
        },
        {
          "subcheck_id": "dependency-target-unresolved",
          "decides": true,
          "spec_ref": "ATS-1 4.24, 7.18",
          "vocabulary_source": "none",
          "description": "A relation's dependency_target resolves to no declared object, so the unit's declared dependencies are incomplete."
        }
      ],
      "surfaces": [
        "ir"
      ],
      "unavailable_conditions": [
        "A document with no extractable normative unit declares no unit whose local closure can be checked."
      ]
    },
    {
      "authority": "conformance_evidence",
      "authority_basis_ref": "docs/AUTHORITY_MODEL.md#ats-ir-rule",
      "available_inputs": [
        "ir_document",
        "stable_coordinates",
        "profile"
      ],
      "blocking_inputs": [],
      "decision_power": "decides",
      "detector_class": "D1",
      "detector_name": "ats-ir-ats-coord-001",
      "implemented": true,
      "known_limits": [
        "Declaration and resolution are exact set checks over the IR: every protected coordinate used must be declared, and every declared coordinate must resolve to a real claim, requirement, relation, or update indicator. Whether a coordinate still denotes the same semantic object after a transformation is a semantic judgement this mechanical check does not make."
      ],
      "missing_inputs": [],
      "produces_conformance_evidence": true,
      "required_inputs": [
        "ir_document",
        "stable_coordinates",
        "profile"
      ],
      "rule_id": "ATS-COORD-001",
      "subchecks": [
        {
          "subcheck_id": "coordinate-used-but-undeclared",
          "decides": true,
          "spec_ref": "ATS-1 4.23, 7.17",
          "vocabulary_source": "the protected coordinate kinds enumerated at ATS-1 4.23",
          "description": "A protected coordinate used in the IR (requirement_id, decision_id, acceptance_criterion_id, dependency_target, or cross-document authority reference) is not declared in the document's stable_coordinates block."
        },
        {
          "subcheck_id": "declared-coordinate-unresolved",
          "decides": true,
          "spec_ref": "ATS-1 4.23, 7.17",
          "vocabulary_source": "none",
          "description": "A coordinate declared in stable_coordinates resolves to no claim, requirement, relation, or update indicator id in the IR."
        }
      ],
      "surfaces": [
        "ir"
      ],
      "unavailable_conditions": [
        "A document with no stable_coordinates block declares no coordinate set to preserve, and a document that uses no protected coordinate id has nothing to resolve."
      ]
    },
    {
      "authority": "conformance_evidence",
      "authority_basis_ref": "docs/AUTHORITY_MODEL.md#ats-ir-rule",
      "available_inputs": [
        "ir_document",
        "stable_coordinates",
        "profile"
      ],
      "blocking_inputs": [],
      "decision_power": "decides",
      "detector_class": "D1",
      "detector_name": "ats-ir-ats-coord-002",
      "implemented": true,
      "known_limits": [
        "Uniqueness and reference resolution are exact mechanical checks over declared ids. Whether two distinct coordinates denote the same semantic object is a semantic judgement this detector does not make."
      ],
      "missing_inputs": [],
      "produces_conformance_evidence": true,
      "required_inputs": [
        "ir_document",
        "stable_coordinates",
        "profile"
      ],
      "rule_id": "ATS-COORD-002",
      "subchecks": [
        {
          "subcheck_id": "duplicate-coordinate-id",
          "decides": true,
          "spec_ref": "ATS-1 4.23, 7.17",
          "vocabulary_source": "none",
          "description": "The same coordinate id is declared twice in stable_coordinates, so coordinate integrity is broken."
        },
        {
          "subcheck_id": "dependency-target-unresolved",
          "decides": true,
          "spec_ref": "ATS-1 4.23, 7.17",
          "vocabulary_source": "none",
          "description": "A relation's dependency_target does not resolve to a declared coordinate or IR object."
        },
        {